{
    "version": "1.0",
    "ignoreMissingPlugins": true,
    "plugins": {
        "unknown1": {}
    },
    "projections": {
        "a": {
            "plugins": {
                "unknown2": {}
            }
        },
        "b": {
            "plugins": {
                "unknown3": {}
            }
        }
    }
}
